{
 "type": "rcp.context_assertion",
 "rcp_version": "0.2-draft",
 "assertion_id": "assertion:inf-from-derived",
 "assertion_type": "commitment",
 "relationship_scope": {
  "scope_type": "bilateral",
  "participants": [
   {
    "actor_id": "A",
    "scope": "tenant:t1",
    "actor_type": "person"
   },
   {
    "actor_id": "B",
    "scope": "tenant:t1",
    "actor_type": "person"
   }
  ],
  "trust_domain": "tenant:t1"
 },
 "epistemic_class": "system_interpretation",
 "statement": "A and B have an open commitment.",
 "provenance": {
  "mode": "derived",
  "visibility": "hidden",
  "derivation": {
   "dependencies": [
    {
     "dependency_ref": "evidence:a-private-journal",
     "dependency_type": "evidence",
     "role": "supports",
     "material": true
    },
    {
     "dependency_ref": "evidence:b-private-email",
     "dependency_type": "evidence",
     "role": "corroborates",
     "material": true
    }
   ],
   "support_sets": [
    [
     "evidence:a-private-journal"
    ],
    [
     "evidence:b-private-email"
    ]
   ]
  }
 },
 "lifecycle": {
  "state": "active"
 },
 "created_at": "2026-10-09T00:00:00Z"
}