{
  "type": "rcp.context_assertion",
  "rcp_version": "0.2-draft",
  "assertion_id": "assertion:binding-equivalent",
  "assertion_type": "preference",
  "relationship_scope": {
    "relationship_ref": "relationship:a-b",
    "scope_type": "bilateral",
    "participants": [
      {"actor_id": "A", "scope": "tenant:t1", "actor_type": "person"},
      {"actor_id": "B", "scope": "tenant:t1", "actor_type": "person"}
    ],
    "trust_domain": "tenant:t1"
  },
  "epistemic_class": "user_observation",
  "statement": "B prefers asynchronous updates.",
  "provenance": {
    "mode": "opaque",
    "visibility": "opaque",
    "note": "Provider retains underlying source evidence."
  },
  "policy_refs": ["policy:provider-local-visible"],
  "lifecycle": {
    "state": "active"
  },
  "created_at": "2026-10-04T09:00:00Z"
}
