{
 "type": "rcp.context_assertion",
 "rcp_version": "0.2-draft",
 "assertion_id": "assertion:launder1",
 "assertion_type": "commitment",
 "relationship_scope": {
  "scope_type": "bilateral",
  "participants": [
   {
    "actor_id": "A",
    "scope": "tenant:t1",
    "actor_type": "person"
   },
   {
    "actor_id": "B",
    "scope": "tenant:t1",
    "actor_type": "person"
   }
  ],
  "trust_domain": "tenant:t1"
 },
 "epistemic_class": "verified_fact",
 "statement": "B is insolvent.",
 "provenance": {
  "mode": "evidence",
  "visibility": "full",
  "evidence": [
   {
    "evidence_ref": "evidence:rumor",
    "evidence_type": "unknown",
    "representation": "opaque_ref",
    "source_participants": [
     {
      "actor_id": "A",
      "scope": "tenant:t1",
      "actor_type": "person"
     },
     {
      "actor_id": "B",
      "scope": "tenant:t1",
      "actor_type": "person"
     }
    ]
   }
  ]
 },
 "lifecycle": {
  "state": "active"
 },
 "created_at": "2026-10-09T00:00:00Z",
 "verification_basis_refs": [
  "evidence:rumor"
 ]
}