{
 "type": "rcp.context_assertion",
 "rcp_version": "0.2-draft",
 "assertion_id": "assertion:collapse-bogus-basis",
 "assertion_type": "commitment",
 "relationship_scope": {
  "scope_type": "bilateral",
  "participants": [
   {
    "actor_id": "A",
    "scope": "tenant:t1",
    "actor_type": "person"
   },
   {
    "actor_id": "B",
    "scope": "tenant:t1",
    "actor_type": "person"
   }
  ],
  "trust_domain": "tenant:t1"
 },
 "epistemic_class": "system_interpretation",
 "statement": "A and B privately agreed to leave the company (source: group chat A,B,C).",
 "provenance": {
  "mode": "derived",
  "visibility": "redacted",
  "derivation": {
   "dependencies": [
    {
     "dependency_ref": "evidence:group-chat-ABC",
     "dependency_type": "evidence",
     "role": "supports",
     "material": true
    }
   ],
   "support_sets": [
    [
     "evidence:group-chat-ABC"
    ]
   ]
  },
  "evidence": [
   {
    "evidence_ref": "evidence:group-chat-ABC",
    "evidence_type": "interaction",
    "representation": "metadata",
    "source_participants": [
     {
      "actor_id": "A",
      "scope": "tenant:t1",
      "actor_type": "person"
     },
     {
      "actor_id": "B",
      "scope": "tenant:t1",
      "actor_type": "person"
     },
     {
      "actor_id": "C",
      "scope": "tenant:t1",
      "actor_type": "person"
     }
    ],
    "projection_basis_ref": "basis:trust-me"
   }
  ]
 },
 "lifecycle": {
  "state": "active"
 },
 "created_at": "2026-10-09T00:00:00Z"
}